コメント,メンバー,ハッシュタグ
（座長になった時）周りの先輩方が「そんなに不安になることはないよ」「周りを頼って良いんだよ」と声をかけてくださって…。これまで以上に先輩方の温かさや偉大さを感じたと同時にやってやるぞという気合いが入ったんです,#岩本蓮加,#乃木坂46 #言葉
「自分が先輩になった」という自覚と責任がはっきりと芽生えたのは、４期生と一緒にライブをするようになったり、みんなが選抜メンバー入りするようになったりしてからだと思います,#岩本蓮加,#乃木坂46 #言葉
（４期生は）すごくフレンドリーで積極的な子たちだなと思います。私たち3期生は加入当初、とても消極的で先輩方と距離を縮めるまでに時間がかかってしまったので、甘え上手で無邪気な4期生のみんなから学ぶことも多いんです,#岩本蓮加,#乃木坂46 #言葉
後輩が入ってきたことでグループについて深く考える機会が増えました。キャプテンの秋元真夏さんや2期生の新内眞衣さんなど、年上の先輩方と今後について真剣に話すようになったことは、私にとっても大きな成長だと感じています,#岩本蓮加,#乃木坂46 #言葉
3期生は休業を経験したメンバーもいますが、一人ひとりが色々な葛藤を乗り越えた上で「グループに帰る」という選択をしてくれたからこそ、5年間12人で活動できたのだと思っています,#岩本蓮加,#乃木坂46 #言葉
辞めたいというより、逃げたいと思ったことが何度もあります。乃木坂46は常に形が変化していくグループだし、選抜発表など大人数で活動する上では常に気を張る場面がつきもので、感情がとても忙しくて…,#岩本蓮加,#乃木坂46 #言葉
加入当初は楽観的な性格だったのですが、活動をする中で深く考えすぎるようになったり緊張しやすくなったりして、年齢を重ねるごとに落ち込みやすくなってしまったんです,#岩本蓮加,#乃木坂46 #言葉
気分が落ちてしまった時期は、朝起きたときに体が上手く動かなかったりしたこともあったのですが、休業することも卒業を選ぶことも、ものすごく大きな覚悟が必要で…,#岩本蓮加,#乃木坂46 #言葉
同期や先輩方がたくさん話を聞いてくれたことが大きな支えとなりました。特に真夏さんにはたくさん相談をしていたのですが、いつも慰めてくれるだけではなく私の話に共感してくれたり一緒に悩んでくれたりしたんです,#岩本蓮加,#乃木坂46 #言葉
周りのサポートがあったからこそ、壊れそうになってしまった時期を乗り越えることができたと思うので、私も後輩にやっていけたら良いなと思います,#岩本蓮加,#乃木坂46 #言葉
私はただ慰められてばかりいると「みんなは人を慰められるくらい強いんだな。悩んでいるのは自分だけなのかな…」と孤独に感じてしまうことがあるので、偉大な先輩方も悩むことがあるんだと分かったことが大きな救いになりました,#岩本蓮加,#乃木坂46 #言葉
自分の気持ちを口に出すことが大切だと思います。言葉にすることで自分の気持ちを整理することができるし、会話の中でちょっとしたアドバイスをいただけたり、自分では気が付かなかった感情を知ることができたり…,#岩本蓮加,#乃木坂46 #言葉
写真を選べないなら全部くっつけちゃえばいいじゃない,#池田瑛紗,#乃木坂46 #言葉
恋なんて制御不能〜のとこ、カメラで抜かれた時うっかりいろはのスカートをブォン！ってしちゃって内心やべ！って思ったのですが完成されたMVを見てなんだかとても素敵な感じになっていたので結果オーライってことにしたいと思います #池田瑛紗 #乃木坂46 #言葉
紅白歌合戦出場、レコード大賞受賞、東京ドームライブ、アジア進出、無名だったわたし達が乃木坂46というグループとしてどんどん色んな人に認められていくのはとても不思議な感覚でした,#井上小百合,#乃木坂46 #言葉
アンダーの気持ちも知っていることは、私の武器になるんじゃないのかなととらえています。今回の選抜(13thシングル)の中でも私や（齋藤）飛鳥がアンダーから初めて福神になってますけど、そこは強みなのかなって,#衛藤美彩,#乃木坂46 #言葉
アンダーでの経験は、あの時を経験しているから何かあったとしても全然乗り越えられる、みたいに自分を励ます材料になっているという感じです,#衛藤美彩,#乃木坂46 #言葉
9thの頃は選抜には入ったけれど3列目ということもあって、自分なりのジレンマを抱えていたんです。 #衛藤美彩 #乃木坂46 #言葉 #今話したいなにかがある,#衛藤美彩,#乃木坂46 #言葉
アンダーメンバーだったらアンダーライブという活躍の場があるのに……という中で、自分が今アンダーライブを見たら苦しくなるだろうと思って見に行けなかったんですよ,#衛藤美彩,#乃木坂46 #言葉
私は今その立場にはいないけど、自分もそこにいたんだなっていうこととか。自分もそこにいたから、みんなの気持ちもわかるし。みんなが輝いて見えるんですよ、アンダーライブって。なので、自分も頑張らなきゃって思わせてくれますし,#衛藤美彩,#乃木坂46 #言葉
いただいたお仕事はチャレンジ精神で全部やってみて、それでやっぱり向いてないなと思うかもしれないし、興味が出るかもしれないし。そういうことが5年後、10年後につながると思ってるので,#衛藤美彩,#乃木坂46 #言葉
私がオーディションを受けた時、審査員の方に『もしここで落ちたとしても、あなたたちはここにいるということが本当に奇跡なんだから、何も諦めることもないし、何も悪いところはないよ』と言っていただいて、すごく嬉しかったんです,#久保史緒里,#乃木坂46 #言葉
オーディションは落ちたらもちろん悔しいけれど、挑戦した事実が素敵なことで、そんな勇気のある行動ができる人は実はそんなに多くないと思うので、誇りに思って欲しいなと思います。全員すごいことなんだよと伝えたいです！,#久保史緒里,#乃木坂46 #言葉
オーディションに応募した時は不安や恐怖がなかったのに、合格発表の時に嬉しさと恐怖が同時に来ました,#久保史緒里,#乃木坂46 #言葉
たくさんつらいことも悲しいことも葉月たちよりもたくさんあったかもしれないけど、そういうのを全然出さない強さとか優しさは『乃木坂が作ったんだな』って思うと、これからも私たちがつないでいかないといけないって思います,#向井葉月,#乃木坂46 #言葉
私の人格はここ（乃木坂46）で作られ、自分で言うのもなんですが、すごくいい人間になったなと思ってます。これからもこの自分を大切に生きていきたいなと思います。ここまで育ててくださり、本当にありがとうございました,#北野日奈子,#乃木坂46 #言葉
学生の頃ずっと人間関係に悩んでいた私に、こんなに大切な人たちができるとは思いもしませんでした。ここへ来て、みんなに出会えて、本当に幸せでした。来世も、みんなで乃木坂46をやろうね,#北野日奈子,#乃木坂46 #言葉
今までうれしいことよりもつらい出来事のほうが多かったはずなのに、今、思ったら、全部が、そのすべてが、美しい思い出だったなって思えている自分がいました,#樋口日奈,#乃木坂46 #言葉
1年前の自分は、乃木坂に受け入れて貰えるのかなとか、これからのアイドルとしての人生にものすごく不安を抱えていました 正直この日を迎えるのがすっごく怖かったです…,#池田瑛紗,#乃木坂46 #言葉
複雑に見えるこの世界は　単純な感情で動いている,#世界には愛しかない,#欅坂46 #歌詞
自己肯定感は自分を優れていると思うことではなくて､優れていなくてもダメでも「それでも自分は大丈夫だ」と思えること,#中西アルノ,#乃木坂46 #言葉
みんなが居たからやさしい気持ちになれました。一人一人が尊敬し合える、そんなみんなだからこそ乃木坂46は素敵なグループなんだと思います,＃樋口日奈,#乃木坂46 #言葉
2011年に出会い走り出した私たちは2022年共に1つのゴールへ辿り着きます。辛い時も嬉しい時も常にまあやが隣にいました。まあやの明るさ優しさに何度心が救われたことか…。まあやが居なかったらここまで強くなれなかったです,＃樋口日奈,#乃木坂46 #言葉
そもそも当初はアイドルやグループ活動に興味はありませんでした。でも、乃木坂46のアートワークや衣装や曲に触れてみて、「これまでになかったジャンルのグループかもしれない」と感じたことでアイドルとしての活動に前向きになれました,＃伊藤万理華,#言葉
初期の頃に撮影したCDはタイプごとにジャケット写真が異なり、実はその一枚一枚に物語が込められていて。メンバーの目線ひとつにも意味があるというのをスタッフさんから説明されたとき、「これがモノづくりなんだ！」とものすごく感動しました,＃伊藤万理華,#言葉
5期生は誰かが弱くなったときには､誰かがつよくなるんだね,#新・乃木坂スター誕生スタッフ,#乃木坂46 #言葉
私のなかでリーダー（キャプテン）イコール、「受け継ぐ人」なんですよ チームを引っ張るとか、活躍できる人は他にもいるけど、受け継がなきゃいけないものを受け継ぐのがリーダー,＃秋元真夏,#乃木坂46 #言葉
メンバー同士の仲は、すごくいいと思います。ただ、同じ方向を目指しているわけではない それぞれの個性を発揮するために、「乃木坂46」というひとつの船に乗っている感じですね,＃久保史緒里,#乃木坂46 #言葉
初心に戻って頑張りたいと思わせてくれたのがアンダーライブでした。アンダーに参加するようになってからは先輩方をより研究して、いろんなことを貪欲に吸収したいなと意識が変わっていきました,#林瑠奈,#乃木坂46 #言葉
私は周りから暗く見られていることが多いのかなと思っているのですが、本当は明るく見られたいなと思っていた時に、飛鳥さんが「明るいって思っていた」「笑顔の印象がある」とその時に１番言われたかった言葉をかけてくださったのがとても嬉しかったです,#柴田柚菜,#乃木坂46 #言葉
夢を叶える秘訣は「具体的に考えること」だと思います。「これやりたい」と思っても叶えたいことのためには何をしたらいいのか、さらにそれをするにはどうしようと具体的に考えて、たくさんそれに見合った努力をするのが大事だと思います,#柴田柚菜,#乃木坂46 #言葉
選抜発表の後、３期生の吉田綾乃クリスティーさんが１番に連絡をくださったのですが「気持ちはわかってあげられないところもあるかもしれないけど、いつでも話を聞くし見守ってるよ」とメッセージをくれたことが本当に嬉しくて,#林瑠奈,#乃木坂46 #言葉
ファンとして応援していた頃は乃木坂46の綺麗な部分しか見えていなかったので、メンバーになってから「裏ではみんなこんなに努力していたんだ」と驚くことが本当に多いです,#林瑠奈,#乃木坂46 #言葉
普段から「オリジナルを受け継ぐことの難しさ」を実感しているのですが、私たちは1期生や2期生の先輩方が卒業された後に“コピーのコピー”が連鎖していかないようにする必要があると思っています,#林瑠奈,#乃木坂46 #言葉
個人的には、今年3月にぴあアリーナMMで開催した「29thSGアンダーライブ」が大きな経験になったと感じています。3日間乗り越えたことで自分も一皮むけることができたんじゃないかなと思っています,#林瑠奈,#乃木坂46 #言葉
そういった向き合い方が夢を叶えるための近道というか、1番正しい道だったと実感しているので、自分がすべきことを理解した上で、その物事に対してしつこく、貪欲に行動していくことが大切だと思います,#林瑠奈,#乃木坂46 #言葉
私はアンダーライブが大好き。でも、アンダーがいいわけではなくて、選抜がいいです。アンダーライブは楽しいけれど、自分の立場に悔しさを持ちながら毎公演ステージに立っていました。悔しさこそが、アンダーの強さだと思っています,＃阪口珠美,#乃木坂46 #言葉
